{
  "productOrService": "AI agent workspace",
  "role": "processor",
  "dataSubjects": [
    "customer employees",
    "contractors",
    "workspace guests"
  ],
  "personalDataCategories": [
    "names",
    "email addresses",
    "workspace documents",
    "prompt inputs",
    "tool activity logs"
  ],
  "specialCategoryData": [],
  "subprocessors": [
    {
      "name": "Frontier Model Provider",
      "location": "non-EU United States",
      "purpose": "LLM inference"
    },
    {
      "name": "Vector Hosting Provider",
      "location": "EU",
      "purpose": "retrieval index hosting"
    }
  ],
  "transferLocations": [
    "EU",
    "US"
  ],
  "retentionPeriod": "Term of agreement plus 30 days",
  "deletionProcess": "Certified deletion within 30 days after customer request",
  "securityAnnexStatus": "Custom Customer Requirements",
  "customerRequestedChanges": [
    "Customer asks for custom audit rights over model providers",
    "Customer asks for prior notice of every subprocessor change"
  ],
  "riskLevel": "high",
  "missingFacts": [
    "Confirm whether zero data retention is active for the model provider tenant"
  ]
}
